{
  "$schema": "http://json-schema.org/draft-07/schema#",
  "title": "Normalized asset record",
  "description": "One observed asset/service produced by the recon engine. Every prober and adapter emits this single versioned shape.",
  "type": "object",
  "required": [
    "schema_version", "observed_at", "target", "port", "protocol",
    "service", "source_tool", "source_file", "confidence", "notes"
  ],
  "properties": {
    "schema_version": { "type": "string", "const": "1.0" },
    "observed_at": { "type": "string", "description": "UTC ISO-8601 timestamp; excluded from the deterministic result hash." },
    "target": { "type": "string", "description": "Host the observation is about, e.g. 127.0.0.1" },
    "port": { "type": "integer" },
    "protocol": { "type": "string", "description": "tcp, http, signal, etc." },
    "service": { "type": "string", "description": "Identified service: http, signal, unknown, ..." },
    "source_tool": { "type": "string", "description": "Which module/tool produced the record." },
    "source_file": { "type": "string", "description": "Relative path to the raw evidence for this record." },
    "confidence": { "type": "number", "minimum": 0, "maximum": 1 },
    "notes": { "type": "string" },
    "vhost": { "type": "string", "description": "Virtual host, when applicable." },
    "commands": { "type": "array", "items": { "type": "string" }, "description": "Signal-service commands discovered via CAPS." },
    "baseline_class": { "type": "string", "enum": ["retain", "suppress"], "description": "Wildcard baseline comparison result for vhost records." },
    "paths": { "type": "array", "items": { "type": "string" }, "description": "HTTP paths observed behind the genuine vhost." },
    "credentials_found": { "type": "boolean", "description": "Whether credentials were discovered (values are not stored in the record)." }
  },
  "additionalProperties": false
}
